{
  "$schema": "https://json-schema.org/draft/2020-12/schema",
  "$id": "https://schemas.apas.example/ii/v4/result-envelope.schema.json",
  "title": "Governed Result Envelope",
  "type": "object",
  "additionalProperties": false,
  "required": [
    "id",
    "tenant_id",
    "analysis_request_id",
    "evidence_class",
    "quantity_type",
    "state",
    "boundary_id",
    "time_basis",
    "producer",
    "source_refs",
    "warnings",
    "assurance_state",
    "review_state",
    "result_path",
    "created_at"
  ],
  "properties": {
    "id": {"type": "string", "pattern": "^result_[a-z0-9_]+$"},
    "tenant_id": {"type": "string", "minLength": 3},
    "analysis_request_id": {"type": "string", "minLength": 3},
    "metric_id": {"type": "string", "pattern": "^M-[0-9]+$"},
    "evidence_class": {
      "enum": ["observed", "calculated", "modeled", "reconciled", "interpreted"]
    },
    "quantity_type": {"type": "string", "minLength": 1},
    "state": {
      "enum": [
        "available",
        "warning",
        "blocked",
        "failed",
        "not_run",
        "not_applicable",
        "review_required"
      ]
    },
    "value": {"type": ["number", "string", "boolean", "null"]},
    "unit": {"type": ["string", "null"]},
    "full_precision_value": {"type": ["number", "string", "null"]},
    "display_value": {"type": ["string", "null"]},
    "boundary_id": {"type": "string", "minLength": 3},
    "time_basis": {
      "type": "object",
      "additionalProperties": false,
      "required": ["start", "end", "time_zone"],
      "properties": {
        "start": {"type": "string", "format": "date-time"},
        "end": {"type": "string", "format": "date-time"},
        "time_zone": {"type": "string", "minLength": 1}
      }
    },
    "snapshot_id": {"type": ["string", "null"]},
    "producer": {
      "type": "object",
      "additionalProperties": false,
      "required": ["type", "id", "version"],
      "properties": {
        "type": {"enum": ["source", "formula", "model", "reconciliation", "human_interpretation"]},
        "id": {"type": "string", "minLength": 1},
        "version": {"type": "string", "minLength": 1},
        "run_id": {"type": ["string", "null"]}
      }
    },
    "dependency_result_ids": {
      "type": "array",
      "uniqueItems": true,
      "items": {"type": "string"}
    },
    "source_refs": {
      "type": "array",
      "items": {"type": "string"}
    },
    "warnings": {
      "type": "array",
      "items": {"type": "string"}
    },
    "uncertainty": {
      "type": ["object", "null"],
      "properties": {
        "method": {"type": "string"},
        "lower": {"type": ["number", "null"]},
        "upper": {"type": ["number", "null"]},
        "confidence": {"type": ["number", "null"]}
      }
    },
    "assurance_state": {
      "enum": [
        "source_accepted",
        "formula_candidate",
        "formula_reviewed",
        "model_exploratory",
        "model_calibrated",
        "model_validated",
        "approved_for_screening",
        "approved_for_planning",
        "expired",
        "rejected",
        "not_applicable"
      ]
    },
    "review_state": {
      "enum": ["unreviewed", "review_required", "accepted", "rejected", "superseded"]
    },
    "result_path": {"type": "string", "minLength": 1},
    "created_at": {"type": "string", "format": "date-time"}
  },
  "allOf": [
    {
      "if": {
        "properties": {"state": {"enum": ["available", "warning"]}}
      },
      "then": {
        "required": ["value", "unit"]
      }
    }
  ]
}
